{
  "schemaVersion": 1,
  "runId": "run_20260718_122355_phase7_1_local_integration",
  "phase": "phase7",
  "category": "validation",
  "executedAt": "2026-07-18T12:23:55",
  "purpose": "not_recorded",
  "hypothesis": "not_recorded",
  "topology": "local-only",
  "majorSettings": [],
  "sourceRevision": "not_recorded",
  "status": "unknown",
  "rawStatus": "completed",
  "validity": "unknown",
  "keyMetrics": [
    {
      "name": "status",
      "value": "completed",
      "source": "run_20260718_122355_phase7_1_local_integration/run.json"
    },
    {
      "name": "verdict",
      "value": "passed",
      "source": "run_20260718_122355_phase7_1_local_integration/run.json"
    },
    {
      "name": "awsNetworkAudit.localRequests",
      "value": 19,
      "source": "run_20260718_122355_phase7_1_local_integration/metrics-summary.json"
    },
    {
      "name": "awsNetworkAudit.realAwsRequests",
      "value": 0,
      "source": "run_20260718_122355_phase7_1_local_integration/metrics-summary.json"
    },
    {
      "name": "haproxy.allErrorsLogged",
      "value": true,
      "source": "run_20260718_122355_phase7_1_local_integration/metrics-summary.json"
    },
    {
      "name": "haproxy.sampledRequestLogLines",
      "value": 25,
      "source": "run_20260718_122355_phase7_1_local_integration/metrics-summary.json"
    },
    {
      "name": "haproxy.successLogSampleRate",
      "value": "1/1000",
      "source": "run_20260718_122355_phase7_1_local_integration/metrics-summary.json"
    },
    {
      "name": "localThroughputIsCapacityGate",
      "value": false,
      "source": "run_20260718_122355_phase7_1_local_integration/metrics-summary.json"
    },
    {
      "name": "overlap.achievedRps",
      "value": 141.345511,
      "source": "run_20260718_122355_phase7_1_local_integration/metrics-summary.json"
    },
    {
      "name": "overlap.durationSeconds",
      "value": 169.796691,
      "source": "run_20260718_122355_phase7_1_local_integration/metrics-summary.json"
    },
    {
      "name": "overlap.records",
      "value": 24000,
      "source": "run_20260718_122355_phase7_1_local_integration/metrics-summary.json"
    },
    {
      "name": "overlap.requestedRps",
      "value": 200,
      "source": "run_20260718_122355_phase7_1_local_integration/metrics-summary.json"
    },
    {
      "name": "status",
      "value": "passed",
      "source": "run_20260718_122355_phase7_1_local_integration/metrics-summary.json"
    }
  ],
  "correctnessStatus": "passed",
  "costStatus": "not_recorded",
  "cleanupStatus": "passed",
  "conclusion": "passed",
  "limitations": [
    "not_recorded"
  ],
  "relatedIncidents": [],
  "provenance": {
    "snapshotId": "snapshot_20260719T200907Z",
    "workspaceArchiveSha256": "773aae45e7ba300535741a79bccd503704d8bc4d4716dbb72e3f59206f808417",
    "sourceHeadAtSnapshot": "304bfeb8bd0808797e28293b74a073d5c5e5ef11",
    "sourcePaths": [
      "run_20260718_122355_phase7_1_local_integration"
    ]
  },
  "sourceEvidence": [
    {
      "path": "run_20260718_122355_phase7_1_local_integration/cleanup-verification.json",
      "bytes": 203,
      "sha256": "b74800e864e7ea7dfb1fd341b96f6ce069e77957fbedd97034a9d3accab9535e"
    },
    {
      "path": "run_20260718_122355_phase7_1_local_integration/commands.md",
      "bytes": 45,
      "sha256": "c0c126847626f5bdbb0f329c7bc85bce2d287220e95691dab8c927b4116b3062"
    },
    {
      "path": "run_20260718_122355_phase7_1_local_integration/correctness-summary.json",
      "bytes": 379,
      "sha256": "01278d0e9cc39dced72743ac59e821d393e544873aaad91b7a5f88cf3989c8b4"
    },
    {
      "path": "run_20260718_122355_phase7_1_local_integration/infra.md",
      "bytes": 142,
      "sha256": "a1ce6fcf27e137a4e095ab15440472bec5ffb57508855dec11ea986d5bfb75ca"
    },
    {
      "path": "run_20260718_122355_phase7_1_local_integration/metrics-summary.json",
      "bytes": 1007,
      "sha256": "2a4a7c5bcfaddcce97695cd6bd233af098dec5bd594e09dfdcad3adf8c26119d"
    },
    {
      "path": "run_20260718_122355_phase7_1_local_integration/report.md",
      "bytes": 289,
      "sha256": "275eb1aebae4c2be7e7c9f5a44f9c2d5998f7d36fd4850e8ea058011a9877eeb"
    },
    {
      "path": "run_20260718_122355_phase7_1_local_integration/run.json",
      "bytes": 507,
      "sha256": "d1290d16058dbfe866da00b5433b7816b29103ed3eabec9bb5c9903c8d156aa2"
    }
  ]
}
