{
  "schemaVersion": 1,
  "runId": "run_20260718_025510_phase7_2_aws_integration",
  "phase": "phase7",
  "category": "experiment",
  "executedAt": "2026-07-18T02:55:10",
  "purpose": "not_recorded",
  "hypothesis": "not_recorded",
  "topology": "not_recorded",
  "majorSettings": [],
  "sourceRevision": "not_recorded",
  "status": "unknown",
  "rawStatus": "finalized",
  "validity": "unknown",
  "keyMetrics": [
    {
      "name": "costModelSha256",
      "value": "f92d53e8c17841538ba277983cbc4013963b99c35e6343886dd0384334aec51a",
      "source": "run_20260718_025510_phase7_2_aws_integration/run.json"
    },
    {
      "name": "finalEvaluation.verdict",
      "value": "blocked",
      "source": "run_20260718_025510_phase7_2_aws_integration/run.json"
    },
    {
      "name": "stageAttempts[0].status",
      "value": "finished",
      "source": "run_20260718_025510_phase7_2_aws_integration/run.json"
    },
    {
      "name": "stageAttempts[1].status",
      "value": "finished",
      "source": "run_20260718_025510_phase7_2_aws_integration/run.json"
    },
    {
      "name": "stageAttempts[2].status",
      "value": "finished",
      "source": "run_20260718_025510_phase7_2_aws_integration/run.json"
    },
    {
      "name": "stageAttempts[3].status",
      "value": "finished",
      "source": "run_20260718_025510_phase7_2_aws_integration/run.json"
    },
    {
      "name": "stageAttempts[4].status",
      "value": "finished",
      "source": "run_20260718_025510_phase7_2_aws_integration/run.json"
    },
    {
      "name": "stageAttempts[5].status",
      "value": "finished",
      "source": "run_20260718_025510_phase7_2_aws_integration/run.json"
    },
    {
      "name": "stageAttempts[6].status",
      "value": "finished",
      "source": "run_20260718_025510_phase7_2_aws_integration/run.json"
    },
    {
      "name": "stageAttempts[7].status",
      "value": "finished",
      "source": "run_20260718_025510_phase7_2_aws_integration/run.json"
    },
    {
      "name": "status",
      "value": "finalized",
      "source": "run_20260718_025510_phase7_2_aws_integration/run.json"
    },
    {
      "name": "verdict",
      "value": "blocked",
      "source": "run_20260718_025510_phase7_2_aws_integration/run.json"
    }
  ],
  "correctnessStatus": "not_recorded",
  "costStatus": "not_recorded",
  "cleanupStatus": "unknown",
  "conclusion": "blocked",
  "limitations": [
    "not_recorded"
  ],
  "relatedIncidents": [],
  "provenance": {
    "snapshotId": "snapshot_20260719T200907Z",
    "workspaceArchiveSha256": "773aae45e7ba300535741a79bccd503704d8bc4d4716dbb72e3f59206f808417",
    "sourceHeadAtSnapshot": "304bfeb8bd0808797e28293b74a073d5c5e5ef11",
    "sourcePaths": [
      "run_20260718_025510_phase7_2_aws_integration"
    ]
  },
  "sourceEvidence": [
    {
      "path": "run_20260718_025510_phase7_2_aws_integration/commands.md",
      "bytes": 22,
      "sha256": "dbfcb6b80244aad6123af88a84e7b56a71b403e8017deabf466a7f39b8109a24"
    },
    {
      "path": "run_20260718_025510_phase7_2_aws_integration/infra.md",
      "bytes": 28,
      "sha256": "e5b9ef7b0e8af729df1f66359d2a1940602af8d1856cde65cac7540203a0441c"
    },
    {
      "path": "run_20260718_025510_phase7_2_aws_integration/report.md",
      "bytes": 1382,
      "sha256": "6e5a339ff1102da2b1d4d1fa159869a4d07f7dd9536d788067e6cc4c528a2ee0"
    },
    {
      "path": "run_20260718_025510_phase7_2_aws_integration/run.json",
      "bytes": 4982,
      "sha256": "cf6eba1b5ecbf0eda9c0774b63cbb01d62f0ca3421e3e05c05f0403855f6ab6a"
    }
  ]
}
