{
  "schemaVersion": 1,
  "runId": "run_20260719_020156_phase7_2_aws_integration",
  "phase": "phase7",
  "category": "experiment",
  "executedAt": "2026-07-19T02:01:56",
  "purpose": "not_recorded",
  "hypothesis": "not_recorded",
  "topology": "not_recorded",
  "majorSettings": [],
  "sourceRevision": "not_recorded",
  "status": "unknown",
  "rawStatus": "finalized",
  "validity": "unknown",
  "keyMetrics": [
    {
      "name": "costModelSha256",
      "value": "82a7b5426deae1def8bb98575dea5b80153a4ca74501d378358e2ebffee9e5c4",
      "source": "run_20260719_020156_phase7_2_aws_integration/run.json"
    },
    {
      "name": "finalEvaluation.verdict",
      "value": "failed",
      "source": "run_20260719_020156_phase7_2_aws_integration/run.json"
    },
    {
      "name": "stageAttempts[0].status",
      "value": "finished",
      "source": "run_20260719_020156_phase7_2_aws_integration/run.json"
    },
    {
      "name": "stageAttempts[1].status",
      "value": "finished",
      "source": "run_20260719_020156_phase7_2_aws_integration/run.json"
    },
    {
      "name": "stageAttempts[2].status",
      "value": "finished",
      "source": "run_20260719_020156_phase7_2_aws_integration/run.json"
    },
    {
      "name": "stageAttempts[3].status",
      "value": "finished",
      "source": "run_20260719_020156_phase7_2_aws_integration/run.json"
    },
    {
      "name": "stageAttempts[4].status",
      "value": "finished",
      "source": "run_20260719_020156_phase7_2_aws_integration/run.json"
    },
    {
      "name": "stageAttempts[5].status",
      "value": "finished",
      "source": "run_20260719_020156_phase7_2_aws_integration/run.json"
    },
    {
      "name": "stageAttempts[6].status",
      "value": "finished",
      "source": "run_20260719_020156_phase7_2_aws_integration/run.json"
    },
    {
      "name": "stageAttempts[7].status",
      "value": "finished",
      "source": "run_20260719_020156_phase7_2_aws_integration/run.json"
    },
    {
      "name": "status",
      "value": "finalized",
      "source": "run_20260719_020156_phase7_2_aws_integration/run.json"
    },
    {
      "name": "verdict",
      "value": "failed",
      "source": "run_20260719_020156_phase7_2_aws_integration/run.json"
    },
    {
      "name": "generatedAt",
      "value": "2026-07-19T03:23:05Z",
      "source": "run_20260719_020156_phase7_2_aws_integration/metrics-summary.json"
    },
    {
      "name": "deployment.passed",
      "value": true,
      "source": "run_20260719_020156_phase7_2_aws_integration/metrics-summary.json"
    },
    {
      "name": "deployment.launchTemplateCount",
      "value": 5,
      "source": "run_20260719_020156_phase7_2_aws_integration/metrics-summary.json"
    },
    {
      "name": "correctness.passed",
      "value": true,
      "source": "run_20260719_020156_phase7_2_aws_integration/metrics-summary.json"
    },
    {
      "name": "correctness.requested",
      "value": 1002,
      "source": "run_20260719_020156_phase7_2_aws_integration/metrics-summary.json"
    },
    {
      "name": "correctness.replacementRequested",
      "value": 900,
      "source": "run_20260719_020156_phase7_2_aws_integration/metrics-summary.json"
    },
    {
      "name": "seed.passed",
      "value": true,
      "source": "run_20260719_020156_phase7_2_aws_integration/metrics-summary.json"
    },
    {
      "name": "seed.uniqueEvents",
      "value": 15000000,
      "source": "run_20260719_020156_phase7_2_aws_integration/metrics-summary.json"
    },
    {
      "name": "warmup.remoteCommandCount",
      "value": 8,
      "source": "run_20260719_020156_phase7_2_aws_integration/metrics-summary.json"
    },
    {
      "name": "warmup.remoteSuccessCount",
      "value": 8,
      "source": "run_20260719_020156_phase7_2_aws_integration/metrics-summary.json"
    },
    {
      "name": "warmup.localObserverFailureCount",
      "value": 8,
      "source": "run_20260719_020156_phase7_2_aws_integration/metrics-summary.json"
    },
    {
      "name": "attemptVerdict",
      "value": "failed",
      "source": "run_20260719_020156_phase7_2_aws_integration/metrics-summary.json"
    }
  ],
  "correctnessStatus": "passed",
  "costStatus": "unknown",
  "cleanupStatus": "unknown",
  "conclusion": "failed",
  "limitations": [
    "not_recorded"
  ],
  "relatedIncidents": [
    "incident-phase7-20260719-020156"
  ],
  "provenance": {
    "snapshotId": "snapshot_20260719T200907Z",
    "workspaceArchiveSha256": "773aae45e7ba300535741a79bccd503704d8bc4d4716dbb72e3f59206f808417",
    "sourceHeadAtSnapshot": "304bfeb8bd0808797e28293b74a073d5c5e5ef11",
    "sourcePaths": [
      "run_20260719_020156_phase7_2_aws_integration"
    ]
  },
  "sourceEvidence": [
    {
      "path": "run_20260719_020156_phase7_2_aws_integration/cleanup-verification.json",
      "bytes": 2330,
      "sha256": "6714577736f6811763f55ba826e16677e1b05c6c185d148412d53fec19fe8b58"
    },
    {
      "path": "run_20260719_020156_phase7_2_aws_integration/commands.md",
      "bytes": 21,
      "sha256": "36bf3ab648efe54631f6db88e6f20fb4b3e57751e521ad7e181e68b80a3a1e87"
    },
    {
      "path": "run_20260719_020156_phase7_2_aws_integration/correctness-summary.json",
      "bytes": 2462,
      "sha256": "0b2b108aebd5b7a0ac14f9a800943b8400e80f1e9888db5adae83dfa046b5f85"
    },
    {
      "path": "run_20260719_020156_phase7_2_aws_integration/cost-status.json",
      "bytes": 828,
      "sha256": "6d1a1992d071f34b81444af43641f08c8c4b086cc9b833482f425c930d60c57c"
    },
    {
      "path": "run_20260719_020156_phase7_2_aws_integration/infra.md",
      "bytes": 27,
      "sha256": "eb92563ef76dff5f591296c3d3d8fa3deedd431e643f468d7edbec42cf2579a2"
    },
    {
      "path": "run_20260719_020156_phase7_2_aws_integration/metrics-summary.json",
      "bytes": 1325,
      "sha256": "3ee8e3f152f297b820d9e4da69ba3e6ebbc661462200c9df28df7f170ad8d9f4"
    },
    {
      "path": "run_20260719_020156_phase7_2_aws_integration/report.md",
      "bytes": 2329,
      "sha256": "25f35172a2cc8e83319b9806ed045f5bc3564642a399c42ef5c7478b24479a68"
    },
    {
      "path": "run_20260719_020156_phase7_2_aws_integration/run.json",
      "bytes": 4857,
      "sha256": "68c855a69ef41b7e6f01f90c3c540d533a1ef05d0050e0b366970abdb9f7cd0c"
    }
  ]
}
