{
  "schemaVersion": 1,
  "runId": "run_20260717_092553_phase7_local",
  "phase": "phase7",
  "category": "validation",
  "executedAt": "2026-07-17T09:25:53",
  "purpose": "not_recorded",
  "hypothesis": "not_recorded",
  "topology": "not_recorded",
  "majorSettings": [],
  "sourceRevision": "not_recorded",
  "status": "unknown",
  "rawStatus": "not_recorded",
  "validity": "unknown",
  "keyMetrics": [],
  "correctnessStatus": "not_recorded",
  "costStatus": "not_recorded",
  "cleanupStatus": "passed",
  "conclusion": "not_recorded",
  "limitations": [
    "not_recorded"
  ],
  "relatedIncidents": [],
  "provenance": {
    "snapshotId": "snapshot_20260719T200907Z",
    "workspaceArchiveSha256": "773aae45e7ba300535741a79bccd503704d8bc4d4716dbb72e3f59206f808417",
    "sourceHeadAtSnapshot": "304bfeb8bd0808797e28293b74a073d5c5e5ef11",
    "sourcePaths": [
      "run_20260717_092553_phase7_local"
    ]
  },
  "sourceEvidence": [
    {
      "path": "run_20260717_092553_phase7_local/cleanup-verification.json",
      "bytes": 203,
      "sha256": "ff5588a03bb77539f7dc9ca28f43cc0ca863ffd67321f0eca53ea77bf8bd8e5e"
    }
  ]
}
