{
  "schemaVersion": 1,
  "runId": "run_20260719_162701_phase7_2_deployment_readiness",
  "phase": "phase7",
  "category": "deployment_readiness",
  "executedAt": "2026-07-19T16:27:01",
  "purpose": "not_recorded",
  "hypothesis": "not_recorded",
  "topology": "not_recorded",
  "majorSettings": [],
  "sourceRevision": "not_recorded",
  "status": "unknown",
  "rawStatus": "not_recorded",
  "validity": "unknown",
  "keyMetrics": [],
  "correctnessStatus": "not_recorded",
  "costStatus": "passed",
  "cleanupStatus": "unknown",
  "conclusion": "not_recorded",
  "limitations": [
    "not_recorded"
  ],
  "relatedIncidents": [
    "incident-phase7-20260719-162701"
  ],
  "provenance": {
    "snapshotId": "snapshot_20260719T200907Z",
    "workspaceArchiveSha256": "773aae45e7ba300535741a79bccd503704d8bc4d4716dbb72e3f59206f808417",
    "sourceHeadAtSnapshot": "304bfeb8bd0808797e28293b74a073d5c5e5ef11",
    "sourcePaths": [
      "run_20260719_162701_phase7_2_deployment_readiness"
    ]
  },
  "sourceEvidence": [
    {
      "path": "run_20260719_162701_phase7_2_deployment_readiness/commands.md",
      "bytes": 1900,
      "sha256": "163fa296467f14ad73555500693b9c327910a361ccc4a4a2d1c78eaac845fd6b"
    },
    {
      "path": "run_20260719_162701_phase7_2_deployment_readiness/cost-model.json",
      "bytes": 13369,
      "sha256": "2761b66a2be0e868598a9c0b53d90ca191a2c249fd980f18131e33939c6306ed"
    }
  ]
}
