{
  "schemaVersion": 1,
  "runId": "run_20260719_043415_phase7_2_aws_integration",
  "phase": "phase7",
  "category": "experiment",
  "executedAt": "2026-07-19T04:34:15",
  "purpose": "not_recorded",
  "hypothesis": "not_recorded",
  "topology": "not_recorded",
  "majorSettings": [],
  "sourceRevision": "not_recorded",
  "status": "unknown",
  "rawStatus": "finalized",
  "validity": "unknown",
  "keyMetrics": [
    {
      "name": "costModelSha256",
      "value": "1e512589c7c68cc10d8f669cf54ab72c56ba6844a11a8f21e3c05b021aa6e899",
      "source": "run_20260719_043415_phase7_2_aws_integration/run.json"
    },
    {
      "name": "finalEvaluation.verdict",
      "value": "failed",
      "source": "run_20260719_043415_phase7_2_aws_integration/run.json"
    },
    {
      "name": "stageAttempts[0].status",
      "value": "finished",
      "source": "run_20260719_043415_phase7_2_aws_integration/run.json"
    },
    {
      "name": "stageAttempts[1].status",
      "value": "finished",
      "source": "run_20260719_043415_phase7_2_aws_integration/run.json"
    },
    {
      "name": "stageAttempts[2].status",
      "value": "finished",
      "source": "run_20260719_043415_phase7_2_aws_integration/run.json"
    },
    {
      "name": "stageAttempts[3].status",
      "value": "finished",
      "source": "run_20260719_043415_phase7_2_aws_integration/run.json"
    },
    {
      "name": "stageAttempts[4].status",
      "value": "finished",
      "source": "run_20260719_043415_phase7_2_aws_integration/run.json"
    },
    {
      "name": "stageAttempts[5].status",
      "value": "finished",
      "source": "run_20260719_043415_phase7_2_aws_integration/run.json"
    },
    {
      "name": "stageAttempts[6].status",
      "value": "finished",
      "source": "run_20260719_043415_phase7_2_aws_integration/run.json"
    },
    {
      "name": "stageAttempts[7].status",
      "value": "finished",
      "source": "run_20260719_043415_phase7_2_aws_integration/run.json"
    },
    {
      "name": "stageAttempts[8].status",
      "value": "finished",
      "source": "run_20260719_043415_phase7_2_aws_integration/run.json"
    },
    {
      "name": "status",
      "value": "finalized",
      "source": "run_20260719_043415_phase7_2_aws_integration/run.json"
    },
    {
      "name": "verdict",
      "value": "failed",
      "source": "run_20260719_043415_phase7_2_aws_integration/run.json"
    },
    {
      "name": "generatedAt",
      "value": "2026-07-19T06:01:58Z",
      "source": "run_20260719_043415_phase7_2_aws_integration/metrics-summary.json"
    },
    {
      "name": "warmup.requestedRequests",
      "value": 9000000,
      "source": "run_20260719_043415_phase7_2_aws_integration/metrics-summary.json"
    },
    {
      "name": "warmup.completedRequests",
      "value": 8999999,
      "source": "run_20260719_043415_phase7_2_aws_integration/metrics-summary.json"
    },
    {
      "name": "warmup.actualRps",
      "value": 49982.18888323431,
      "source": "run_20260719_043415_phase7_2_aws_integration/metrics-summary.json"
    },
    {
      "name": "warmup.transportErrors",
      "value": 1,
      "source": "run_20260719_043415_phase7_2_aws_integration/metrics-summary.json"
    },
    {
      "name": "warmup.correctedP95Ms",
      "value": 119.5158537,
      "source": "run_20260719_043415_phase7_2_aws_integration/metrics-summary.json"
    },
    {
      "name": "warmup.strictAcceptancePassed",
      "value": false,
      "source": "run_20260719_043415_phase7_2_aws_integration/metrics-summary.json"
    },
    {
      "name": "score.requestedRequests",
      "value": 15000000,
      "source": "run_20260719_043415_phase7_2_aws_integration/metrics-summary.json"
    },
    {
      "name": "score.completedRequests",
      "value": 15000000,
      "source": "run_20260719_043415_phase7_2_aws_integration/metrics-summary.json"
    },
    {
      "name": "score.actualRps",
      "value": 49987.713711084536,
      "source": "run_20260719_043415_phase7_2_aws_integration/metrics-summary.json"
    },
    {
      "name": "score.transportErrors",
      "value": 0,
      "source": "run_20260719_043415_phase7_2_aws_integration/metrics-summary.json"
    },
    {
      "name": "score.correctedP95Ms",
      "value": 112.5391715,
      "source": "run_20260719_043415_phase7_2_aws_integration/metrics-summary.json"
    },
    {
      "name": "score.pipelineDrainAndFinalAccountingAvailable",
      "value": false,
      "source": "run_20260719_043415_phase7_2_aws_integration/metrics-summary.json"
    },
    {
      "name": "archive.taskCount",
      "value": 1,
      "source": "run_20260719_043415_phase7_2_aws_integration/metrics-summary.json"
    },
    {
      "name": "verdict",
      "value": "failed",
      "source": "run_20260719_043415_phase7_2_aws_integration/metrics-summary.json"
    }
  ],
  "correctnessStatus": "passed",
  "costStatus": "unknown",
  "cleanupStatus": "unknown",
  "conclusion": "failed",
  "limitations": [
    "not_recorded"
  ],
  "relatedIncidents": [],
  "provenance": {
    "snapshotId": "snapshot_20260719T200907Z",
    "workspaceArchiveSha256": "773aae45e7ba300535741a79bccd503704d8bc4d4716dbb72e3f59206f808417",
    "sourceHeadAtSnapshot": "304bfeb8bd0808797e28293b74a073d5c5e5ef11",
    "sourcePaths": [
      "run_20260719_043415_phase7_2_aws_integration"
    ]
  },
  "sourceEvidence": [
    {
      "path": "run_20260719_043415_phase7_2_aws_integration/cleanup-verification.json",
      "bytes": 1251,
      "sha256": "10a4dc3b1727a6e22c8f694455df1f0ab5fd5a534871a079269125b06a8cbb0d"
    },
    {
      "path": "run_20260719_043415_phase7_2_aws_integration/commands.md",
      "bytes": 565,
      "sha256": "036c5945078bb1dab0cefaa4b2530014d3017d2f17f1a13741ff7c4da1ade0c0"
    },
    {
      "path": "run_20260719_043415_phase7_2_aws_integration/correctness-summary.json",
      "bytes": 2463,
      "sha256": "8c657863e3225ce9a059c36ce159ce331e8c5b0295d3f9545124f4de7fdc87f5"
    },
    {
      "path": "run_20260719_043415_phase7_2_aws_integration/cost-status.json",
      "bytes": 828,
      "sha256": "bfec38cc0b7d858df91e4da348c96351be64aa5a5806129d887a67ee0d6af1b1"
    },
    {
      "path": "run_20260719_043415_phase7_2_aws_integration/infra.md",
      "bytes": 827,
      "sha256": "c8910488b771c429342448d2ea882e8dd810cc2baf7de67313512f5bfa4e4ad3"
    },
    {
      "path": "run_20260719_043415_phase7_2_aws_integration/metrics-summary.json",
      "bytes": 1405,
      "sha256": "672d27d28c9c79e0d698c52f8a0ea16583303673e7d8244df2ffad093adc1c7f"
    },
    {
      "path": "run_20260719_043415_phase7_2_aws_integration/report.md",
      "bytes": 1393,
      "sha256": "e5924878b2432d276145f99108db2c7572bf9986acbc1b3b0f17cc61126feaf6"
    },
    {
      "path": "run_20260719_043415_phase7_2_aws_integration/run.json",
      "bytes": 5288,
      "sha256": "519b6f57456317e4beb69872030b7383d14637679753d5731c752e12285f8e9b"
    }
  ]
}
