{
  "schemaVersion": 1,
  "runId": "run_20260709_193312_phase0_alb_10k",
  "phase": "phase0",
  "category": "experiment",
  "executedAt": "2026-07-09T19:33:12",
  "purpose": "not_recorded",
  "hypothesis": "not_recorded",
  "topology": "not_recorded",
  "majorSettings": [
    {
      "name": "target_rps",
      "value": 10000,
      "source": "run_20260709_193312_phase0_alb_10k/run.json"
    },
    {
      "name": "duration_seconds",
      "value": 300,
      "source": "run_20260709_193312_phase0_alb_10k/run.json"
    }
  ],
  "sourceRevision": "not_recorded",
  "status": "unknown",
  "rawStatus": "not_recorded",
  "validity": "unknown",
  "keyMetrics": [
    {
      "name": "target_rps",
      "value": 10000,
      "source": "run_20260709_193312_phase0_alb_10k/run.json"
    },
    {
      "name": "event_per_request",
      "value": 1,
      "source": "run_20260709_193312_phase0_alb_10k/run.json"
    },
    {
      "name": "duration_seconds",
      "value": 300,
      "source": "run_20260709_193312_phase0_alb_10k/run.json"
    },
    {
      "name": "load_generator.cpu",
      "value": 4,
      "source": "run_20260709_193312_phase0_alb_10k/run.json"
    },
    {
      "name": "load_generator.memory_gib",
      "value": 8,
      "source": "run_20260709_193312_phase0_alb_10k/run.json"
    },
    {
      "name": "status",
      "value": "aborted_after_timeout_saturation",
      "source": "run_20260709_193312_phase0_alb_10k/metrics-summary.json"
    },
    {
      "name": "target_rps",
      "value": 10000,
      "source": "run_20260709_193312_phase0_alb_10k/metrics-summary.json"
    },
    {
      "name": "worker_cpu",
      "value": 4,
      "source": "run_20260709_193312_phase0_alb_10k/metrics-summary.json"
    },
    {
      "name": "worker_memory_gib",
      "value": 8,
      "source": "run_20260709_193312_phase0_alb_10k/metrics-summary.json"
    },
    {
      "name": "requested_fargate_spot_vcpu",
      "value": 16,
      "source": "run_20260709_193312_phase0_alb_10k/metrics-summary.json"
    },
    {
      "name": "fargate_spot_vcpu_quota",
      "value": 30,
      "source": "run_20260709_193312_phase0_alb_10k/metrics-summary.json"
    },
    {
      "name": "observed_from_log.max_request_rate_per_sec",
      "value": 10106,
      "source": "run_20260709_193312_phase0_alb_10k/metrics-summary.json"
    },
    {
      "name": "observed_from_log.http_requests",
      "value": 429669,
      "source": "run_20260709_193312_phase0_alb_10k/metrics-summary.json"
    },
    {
      "name": "observed_from_log.first_timeout_period.request_rate_per_sec",
      "value": 9993,
      "source": "run_20260709_193312_phase0_alb_10k/metrics-summary.json"
    },
    {
      "name": "observed_from_log.first_timeout_period.http_requests",
      "value": 99770,
      "source": "run_20260709_193312_phase0_alb_10k/metrics-summary.json"
    }
  ],
  "correctnessStatus": "not_recorded",
  "costStatus": "not_recorded",
  "cleanupStatus": "unknown",
  "conclusion": "not_recorded",
  "limitations": [
    "not_recorded"
  ],
  "relatedIncidents": [],
  "provenance": {
    "snapshotId": "snapshot_20260719T200907Z",
    "workspaceArchiveSha256": "773aae45e7ba300535741a79bccd503704d8bc4d4716dbb72e3f59206f808417",
    "sourceHeadAtSnapshot": "304bfeb8bd0808797e28293b74a073d5c5e5ef11",
    "sourcePaths": [
      "run_20260709_193312_phase0_alb_10k"
    ]
  },
  "sourceEvidence": [
    {
      "path": "run_20260709_193312_phase0_alb_10k/artifacts.md",
      "bytes": 389,
      "sha256": "1a12ecad52c42f81b5aab4ae1aaa9398081d1f53e45dfc1b7373761df5ff3e81"
    },
    {
      "path": "run_20260709_193312_phase0_alb_10k/commands.md",
      "bytes": 1472,
      "sha256": "9add661c2d3f6533cfcbb71342ec7979995911822024cf0b6e0fe854c98807f9"
    },
    {
      "path": "run_20260709_193312_phase0_alb_10k/infra.md",
      "bytes": 591,
      "sha256": "7944a763289f54f47e858c908a16e600820cca8eb61f0c3b038bd576f92c0492"
    },
    {
      "path": "run_20260709_193312_phase0_alb_10k/metrics-summary.json",
      "bytes": 1182,
      "sha256": "2985f9e3f9c3bdfccc569d0f2e8f220c412e483c226b31ca410133f8550015ba"
    },
    {
      "path": "run_20260709_193312_phase0_alb_10k/report.md",
      "bytes": 1186,
      "sha256": "c8d9174c78bbeb29c2d340cda4f326aae31c532ac38f9570d1c3d6e55d706b0b"
    },
    {
      "path": "run_20260709_193312_phase0_alb_10k/run.json",
      "bytes": 898,
      "sha256": "47b3b4bb797fd052f9c32f1ddd95d0a61ba839cc0de61c15bc0a05eb2267d50e"
    }
  ]
}
