{
  "schemaVersion": 1,
  "runId": "run_20260718_011725_phase7_1_local_integration",
  "phase": "phase7",
  "category": "validation",
  "executedAt": "2026-07-18T01:17:25",
  "purpose": "not_recorded",
  "hypothesis": "not_recorded",
  "topology": "local-only",
  "majorSettings": [],
  "sourceRevision": "not_recorded",
  "status": "unknown",
  "rawStatus": "completed",
  "validity": "unknown",
  "keyMetrics": [
    {
      "name": "status",
      "value": "completed",
      "source": "run_20260718_011725_phase7_1_local_integration/run.json"
    },
    {
      "name": "verdict",
      "value": "failed",
      "source": "run_20260718_011725_phase7_1_local_integration/run.json"
    },
    {
      "name": "localThroughputIsCapacityGate",
      "value": false,
      "source": "run_20260718_011725_phase7_1_local_integration/metrics-summary.json"
    },
    {
      "name": "status",
      "value": "failed",
      "source": "run_20260718_011725_phase7_1_local_integration/metrics-summary.json"
    }
  ],
  "correctnessStatus": "failed",
  "costStatus": "not_recorded",
  "cleanupStatus": "unknown",
  "conclusion": "failed",
  "limitations": [
    "not_recorded"
  ],
  "relatedIncidents": [],
  "provenance": {
    "snapshotId": "snapshot_20260719T200907Z",
    "workspaceArchiveSha256": "773aae45e7ba300535741a79bccd503704d8bc4d4716dbb72e3f59206f808417",
    "sourceHeadAtSnapshot": "304bfeb8bd0808797e28293b74a073d5c5e5ef11",
    "sourcePaths": [
      "run_20260718_011725_phase7_1_local_integration"
    ]
  },
  "sourceEvidence": [
    {
      "path": "run_20260718_011725_phase7_1_local_integration/commands.md",
      "bytes": 45,
      "sha256": "c0c126847626f5bdbb0f329c7bc85bce2d287220e95691dab8c927b4116b3062"
    },
    {
      "path": "run_20260718_011725_phase7_1_local_integration/correctness-summary.json",
      "bytes": 155,
      "sha256": "c00ef51152a05d664db1db9458f8d97ce8c07b2b440b0ea788e73e0ddbdf6971"
    },
    {
      "path": "run_20260718_011725_phase7_1_local_integration/infra.md",
      "bytes": 142,
      "sha256": "a1ce6fcf27e137a4e095ab15440472bec5ffb57508855dec11ea986d5bfb75ca"
    },
    {
      "path": "run_20260718_011725_phase7_1_local_integration/metrics-summary.json",
      "bytes": 158,
      "sha256": "45db7c02b68a5bb288d7760d82db0f213008363d32be8cc3720e2b465711d87f"
    },
    {
      "path": "run_20260718_011725_phase7_1_local_integration/report.md",
      "bytes": 299,
      "sha256": "c02019c581dcfbbd7d30dacd2db577ebd3687fc0e41ab5e609e03791aaec8a93"
    },
    {
      "path": "run_20260718_011725_phase7_1_local_integration/run.json",
      "bytes": 628,
      "sha256": "4400f1dee5b2666cf49f6068ba84c4b5d6e599041a477d4d1e950454e3edd5a2"
    }
  ]
}
