{
  "schemaVersion": 1,
  "runId": "run_20260714_200300_n3_correctness",
  "phase": "phase1",
  "category": "correctness",
  "executedAt": "2026-07-14T20:03:00",
  "purpose": "not_recorded",
  "hypothesis": "not_recorded",
  "topology": "not_recorded",
  "majorSettings": [],
  "sourceRevision": "not_recorded",
  "status": "unknown",
  "rawStatus": "not_recorded",
  "validity": "unknown",
  "keyMetrics": [],
  "correctnessStatus": "failed",
  "costStatus": "not_recorded",
  "cleanupStatus": "unknown",
  "conclusion": "not_recorded",
  "limitations": [
    "not_recorded"
  ],
  "relatedIncidents": [],
  "provenance": {
    "snapshotId": "snapshot_20260719T200907Z",
    "workspaceArchiveSha256": "773aae45e7ba300535741a79bccd503704d8bc4d4716dbb72e3f59206f808417",
    "sourceHeadAtSnapshot": "304bfeb8bd0808797e28293b74a073d5c5e5ef11",
    "sourcePaths": [
      "run_20260714_161818_independent_crossover/correctness/n3/run_20260714_200300_n3_correctness"
    ]
  },
  "sourceEvidence": [
    {
      "path": "run_20260714_161818_independent_crossover/correctness/n3/run_20260714_200300_n3_correctness/correctness-summary.json",
      "bytes": 1059,
      "sha256": "252bfa3c18ad4de329a8f4b38d85915c9415498ec8936034df12a29e8d7dee2d"
    }
  ]
}
